{
  "schema_version": 1,
  "adaptation_version": "0.0.0-baseline-must-not-drive-manifests",
  "upstream_repository": "https://example.invalid/upstream.git",
  "upstream_commit": "0123456789abcdef0123456789abcdef01234567",
  "agents": [
    {"path": "agents/agent-01.md", "line_count": 1, "sha256": "0000000000000000000000000000000000000000000000000000000000000000"},
    {"path": "agents/agent-02.md", "line_count": 1, "sha256": "0000000000000000000000000000000000000000000000000000000000000000"},
    {"path": "agents/agent-03.md", "line_count": 1, "sha256": "0000000000000000000000000000000000000000000000000000000000000000"},
    {"path": "agents/agent-04.md", "line_count": 1, "sha256": "0000000000000000000000000000000000000000000000000000000000000000"},
    {"path": "agents/agent-05.md", "line_count": 1, "sha256": "0000000000000000000000000000000000000000000000000000000000000000"},
    {"path": "agents/agent-06.md", "line_count": 1, "sha256": "0000000000000000000000000000000000000000000000000000000000000000"},
    {"path": "agents/agent-07.md", "line_count": 1, "sha256": "0000000000000000000000000000000000000000000000000000000000000000"},
    {"path": "agents/agent-08.md", "line_count": 1, "sha256": "0000000000000000000000000000000000000000000000000000000000000000"},
    {"path": "agents/agent-09.md", "line_count": 1, "sha256": "0000000000000000000000000000000000000000000000000000000000000000"},
    {"path": "agents/agent-10.md", "line_count": 1, "sha256": "0000000000000000000000000000000000000000000000000000000000000000"},
    {"path": "agents/agent-11.md", "line_count": 1, "sha256": "0000000000000000000000000000000000000000000000000000000000000000"},
    {"path": "agents/agent-12.md", "line_count": 1, "sha256": "0000000000000000000000000000000000000000000000000000000000000000"},
    {"path": "agents/agent-13.md", "line_count": 1, "sha256": "0000000000000000000000000000000000000000000000000000000000000000"},
    {"path": "agents/agent-14.md", "line_count": 1, "sha256": "0000000000000000000000000000000000000000000000000000000000000000"},
    {"path": "agents/agent-15.md", "line_count": 1, "sha256": "0000000000000000000000000000000000000000000000000000000000000000"},
    {"path": "agents/agent-16.md", "line_count": 1, "sha256": "0000000000000000000000000000000000000000000000000000000000000000"},
    {"path": "agents/agent-17.md", "line_count": 1, "sha256": "0000000000000000000000000000000000000000000000000000000000000000"},
    {"path": "agents/agent-18.md", "line_count": 1, "sha256": "0000000000000000000000000000000000000000000000000000000000000000"},
    {"path": "agents/agent-19.md", "line_count": 1, "sha256": "0000000000000000000000000000000000000000000000000000000000000000"},
    {"path": "agents/agent-20.md", "line_count": 1, "sha256": "0000000000000000000000000000000000000000000000000000000000000000"},
    {"path": "agents/agent-21.md", "line_count": 1, "sha256": "0000000000000000000000000000000000000000000000000000000000000000"},
    {"path": "agents/agent-22.md", "line_count": 1, "sha256": "0000000000000000000000000000000000000000000000000000000000000000"},
    {"path": "agents/agent-23.md", "line_count": 1, "sha256": "0000000000000000000000000000000000000000000000000000000000000000"},
    {"path": "agents/agent-24.md", "line_count": 1, "sha256": "0000000000000000000000000000000000000000000000000000000000000000"},
    {"path": "agents/agent-25.md", "line_count": 1, "sha256": "0000000000000000000000000000000000000000000000000000000000000000"},
    {"path": "agents/agent-26.md", "line_count": 1, "sha256": "0000000000000000000000000000000000000000000000000000000000000000"},
    {"path": "agents/agent-27.md", "line_count": 1, "sha256": "0000000000000000000000000000000000000000000000000000000000000000"},
    {"path": "agents/agent-28.md", "line_count": 1, "sha256": "0000000000000000000000000000000000000000000000000000000000000000"},
    {"path": "agents/agent-29.md", "line_count": 1, "sha256": "0000000000000000000000000000000000000000000000000000000000000000"},
    {"path": "agents/agent-30.md", "line_count": 1, "sha256": "0000000000000000000000000000000000000000000000000000000000000000"},
    {"path": "agents/agent-31.md", "line_count": 1, "sha256": "0000000000000000000000000000000000000000000000000000000000000000"},
    {"path": "agents/agent-32.md", "line_count": 1, "sha256": "0000000000000000000000000000000000000000000000000000000000000000"},
    {"path": "agents/agent-33.md", "line_count": 1, "sha256": "0000000000000000000000000000000000000000000000000000000000000000"}
  ],
  "license": {
    "path": "LICENSE",
    "spdx": "MIT",
    "sha256": "0000000000000000000000000000000000000000000000000000000000000000",
    "attribution": "Copyright Example Contributors"
  },
  "approval": {
    "path": "CLAUDE.md",
    "sha256": "0000000000000000000000000000000000000000000000000000000000000000",
    "ranges": [{"start_line": 1, "end_line": 1}]
  }
}
